{
  "agent_id": "L0-impact-assessor-evaluator",
  "agent_version": "1.0.0",
  "execution_id": "exec-be133237-0cbb-5071-9d08-b393f50fb736",
  "workflow_execution_id": "wf-220d8f42-2dfa-5586-8609-c31d910aca82",
  "status": "success",
  "content": {
    "type": "evaluation_result",
    "schema_version": "1.0",
    "items": {
      "scores": {
        "faithfulness": 0.9,
        "hallucination": 0.04,
        "consistency": 0.95,
        "relevance": 0.85,
        "reasoning_quality": 0.9,
        "citation_completeness": 0.96
      },
      "overall_score": 9.2,
      "pass": false,
      "findings": [
        {
          "id": "FND-01",
          "gate": "Input validation & source fetch",
          "status": "pass",
          "detail": "generator_output present (status, items, artifacts[0].content inline); workflow_execution_id inherited; rubric evaluation.md fetched via tool-L0-github-fetch-file; kb-L0-architecture-principles re-fetched (page 524091393)",
          "resolution": "n/a"
        },
        {
          "id": "FND-02",
          "gate": "Capability check (rule 3)",
          "status": "pass",
          "detail": "SVC-101..SVC-104 re-checked: no service covers FNOL capture or claim status tracking; SVC-104 correctly consumed as external dependency (fraud-scoring-api), not duplicated",
          "resolution": "n/a"
        },
        {
          "id": "FND-03",
          "gate": "Technical impact check (rule 4)",
          "status": "pass",
          "detail": "CI-2001..CI-2005 rows reproduced from CMDB + KB; CI-2004 REL-3002 vs AP-LIFE-07 disagreement correctly FLAGGED by generator (not reconciled)",
          "resolution": "n/a"
        },
        {
          "id": "FND-04",
          "gate": "Export freshness/contamination",
          "status": "fail",
          "detail": "Fresh cmdb_export exported 2026-10-28T05:00Z is materially newer than generator's copy (2026-10-25) and contains CI-2006 Claims-Event-Bus (created 2026-10-27) with REL-3003 feeding CI-2003 Notify-Hub — a CI the generator never assessed. Whether claim notifications should route via CI-2006 is a new design judgment, not mechanically recoverable",
          "resolution": "escalated"
        },
        {
          "id": "FND-05",
          "gate": "FR coverage & blast radius (rule 5)",
          "status": "pass",
          "detail": "Re-derived: 7 FRs in prd_output (FR-001, FR-002, FR-003, FR-004, FR-005, FR-006, FR-007); 7/7 present in components_identified with blast_radius+rationale AND in node source_requirement[]",
          "resolution": "n/a"
        },
        {
          "id": "FND-06",
          "gate": "DFS cycle check (rule 6)",
          "status": "pass",
          "detail": "Own DFS over 12 nodes/9 edges (recursion stack tracked): PASS, no back-edge. Generator: PASS []. Agree.",
          "resolution": "n/a"
        },
        {
          "id": "FND-07",
          "gate": "Critical path & ties (rule 6)",
          "status": "pass",
          "detail": "Own longest-path over blocks/depends-on from every root: length 3, 1 chain(s): fraud-scoring-api -> claims-triage-engine -> claims-intake-service -> claims-intake-portal. Generator: 1 chain(s). Agree, all ties reported.",
          "resolution": "n/a"
        },
        {
          "id": "FND-08",
          "gate": "Edge direction (rule 7)",
          "status": "pass",
          "detail": "All 3 blocks edges run dependency → component and every critical-path edge runs prerequisite → dependent, consistent with prerequisite language in the document and KB",
          "resolution": "n/a"
        },
        {
          "id": "FND-09",
          "gate": "Grounding & node uniqueness (rule 8)",
          "status": "pass",
          "detail": "12 node ids, unique=True, kebab-case=True; 7 component nodes trace to Components Identified; 3 external-dependency nodes = external_dependencies_count 3",
          "resolution": "n/a"
        },
        {
          "id": "FND-10",
          "gate": "Distillation & hallucination (rule 9)",
          "status": "pass",
          "detail": "executive_summary 15 words (≤20); all 8 rationale_summary ≤15 words; every executive-summary claim traced to Components/Existing-System/Integration sections; no full-text dumps in summary fields",
          "resolution": "n/a"
        },
        {
          "id": "FND-11",
          "gate": "Mermaid 1:1 (rule 10)",
          "status": "pass",
          "detail": "Mermaid nodes 12 vs JSON 12; edges 9 vs 9; directions+edge styles match=True; shapes match type (rect/[[ ]]/([ ]))=True; labels quoted; classDefs present=True; required %% CRITICAL PATH annotations=True",
          "resolution": "n/a"
        }
      ],
      "fixes_applied": [],
      "final_decision": "escalate_to_hitl"
    },
    "artifacts": [
      {
        "id": "artifact-001",
        "name": "ClaimsIntake Hub-impact-assessment.md",
        "format": "md",
        "content": "# Impact Assessment: ClaimsIntake Hub\n\n## Legend\n| Field | Value |\n|---|---|\n| Source 1 | PRD: `L0-requirements-prd-composer`|\n| Status (*Draft / In-Review / Approved*) | Draft |\n| Approved by (Human Name) | *Human Name* |\n| Date of Approval | *Date* |\n| Human Approval Comments | *Comments* |\n\n> KB: kb-L0-architecture-principles (Confluence page_id 524091393) — mode: cross-check mode (catalog and CMDB populated)\n\n## Executive Summary & Overview\nClaimsIntake Hub is the digital front door for motor and property claims: it captures FNOL, validates coverage, gathers evidence, pre-screens for fraud and keeps policyholders informed, feeding adjusters downstream.\n\nFour new components are introduced and three existing systems (PolicyAdmin-Core, DocVault, Notify-Hub) are extended. The highest blast radius sits on the new Claims Intake Service and on PolicyAdmin-Core, which every claim validation calls. The retiring claims mainframe is excluded, but the CMDB still shows a live relationship to it, which is flagged.\n- **Overall impact level:** High — 2 of 8 FR rows are High (Claims Intake Service, PolicyAdmin-Core) on the synchronous claim path\n- **Existing systems:** 3 impacted, 2 explicitly excluded by architecture decision; duplicate-build risk: none found\n- **External dependencies:** 3 total, 2 newly surfaced by this assessment\n- **Flags:** CMDB/KB mismatch: CMDB REL-3002 shows Legacy-Claims-Mainframe feeding PolicyAdmin-Core; KB marks mainframe retired; KB-mandatory API Gateway and Identity Provider absent from PRD; added as external dependencies\n\n## Non-Functional & Regulatory Impact\nThe 2 s p95 acknowledgement target (CON-001) puts PolicyAdmin-Core coverage lookups on the synchronous path; its current SLA must be confirmed. The 10-year retention (CON-002) applies to the new Claim Status Store and to DocVault attachments. PII encryption (CON-003) applies to all new components; Notify-Hub must not include claim detail in SMS bodies.\n\n## Existing-System Impact\n**Capability check (service catalog, service grain):** Closest catalog matches: SVC-101 Policy Admin Service (coverage lookup only — no claim intake, reused for FR-002/FR-003); SVC-102 Document Management Service (reused for FR-004); SVC-103 Notification Service (reused for FR-006); SVC-104 Fraud Scoring Service (scoring API only, no triage workflow — consumed as an external dependency for FR-005). No catalog service covers FNOL capture or claim status tracking, so no duplicate-build risk.\n\n**Technical impact check (CMDB, configuration-item grain):**\n\n| Existing System (CI) | impacted? | How / Why Not | Component(s) |\n|---|---|---|---|\n| PolicyAdmin-Core (CI-2001) | Yes | New synchronous coverage-lookup consumer; KB-consistent | FR-002, FR-003 |\n| DocVault (CI-2002) | Yes | New document bucket and retention policy for claim evidence | FR-004 |\n| Notify-Hub (CI-2003) | Yes | New claim-status templates and event subscription | FR-006 |\n| Legacy-Claims-Mainframe (CI-2004) | No — by architecture decision | Excluded per CON-004 and KB retirement principle. MISMATCH: CMDB REL-3002 still shows it feeding PolicyAdmin-Core — flagged, not reconciled | — |\n| Enterprise-Data-Warehouse (CI-2005) | No — by architecture decision | Reporting feed is out of scope for this release (PRD); no schema change needed | — |\n\n## Components Identified\n| Requirement | Component (new/existing) | Blast Radius | Rationale |\n|---|---|---|---|\n| FR-001 | Claims Intake Portal (new) | Medium | New customer-facing web/mobile UI; failure blocks FNOL but touches no shared system. Its status-tracking view (FR-007) reads from the Claim Status Store, so the Claim Status Store must be provisioned before the Portal. |\n| FR-002 | Claims Intake Service (new) | High | Orchestrates validation, triage and status for every claim; single choke point on the 2 s path. |\n| FR-003 | PolicyAdmin-Core (existing) | High | System of record for policy; new real-time load from every claim affects all policy consumers. |\n| FR-004 | DocVault (existing) | Medium | New bucket and 10-year retention rule; existing tenants unaffected if quotas isolated. |\n| FR-005 | Claims Triage Engine (new) | Medium | New rules engine calling SVC-104; a false positive delays assignment but not intake. |\n| FR-006 | Notify-Hub (existing) | Low | Template and subscription additions only; no platform change. |\n| FR-007 | Claim Status Store (new) | Medium | New datastore holding audit history under 10-year retention. |\n| FR-002 | Claim Status Store (new) | Medium | Validation outcome is persisted as the first status event. |\n\n## Data Model & Schema Impact\nNew entities: Claim, ClaimStatusEvent, FraudScreenResult (Claim Status Store). DocVault gains a claim-evidence document class with 10-year retention. PolicyAdmin-Core schema unchanged (read-only access).\n\n## Integration Landscape & External Dependencies\n- **Upstream (enterprise platform, KB-mandated):** Identity Provider — Policyholder authentication for the portal; KB principle, absent from PRD.\n-